{
  "schema_version": "0.6",
  "evidence_id": "evidence-demo-1",
  "project_id": "demo",
  "content_sha256": "bc9109c15278e73ce704fd8d2ddc943d41fa0b8e2c5501e932cd225c34accb11",
  "content_ref": "blob:demo-1",
  "observed_at": "2026-09-26T05:00:00Z",
  "source_created_at": null,
  "authenticity": "ATTRIBUTED",
  "integrity": "HASH_VERIFIED",
  "assertion_verification": "UNKNOWN",
  "attempt_id": null,
  "derived_from": []
}
